{
  "artifacts": [
    {
      "architecture": "wasm32",
      "backend": "webgl2",
      "bytes": 297234,
      "contentType": "application/x-tar",
      "kind": "package",
      "minimumSystem": "WebAssembly BigInt + WebGL 2",
      "name": "tjn-web-1.0.0.tgz",
      "platform": "web",
      "sha256": "d9e3cd7cd0fdcdcd1a9e3face2d7fb1458f171b7723f1a6d8dad9fcf7a9cb76e",
      "url": "https://github.com/spawn66336/threejsnative-sdk/releases/download/1.0.0/tjn-web-1.0.0.tgz"
    },
    {
      "architecture": "wasm32",
      "bytes": 2585,
      "contentType": "application/zip",
      "kind": "symbols",
      "name": "tjn-web-1.0.0-symbols.zip",
      "platform": "web",
      "sha256": "7cc980391fe0408ddd46e1fc67f3363030cafe7f4a1125e485e15ff78fa8118a",
      "url": "https://github.com/spawn66336/threejsnative-sdk/releases/download/1.0.0/tjn-web-1.0.0-symbols.zip"
    },
    {
      "architecture": "arm64-v8a+x86_64",
      "backend": "gles",
      "bytes": 4188609,
      "contentType": "application/octet-stream",
      "kind": "package",
      "minimumSystem": "Android API 26",
      "name": "tjn-engine-android-1.0.0.aar",
      "platform": "android",
      "sha256": "6938d62db17ccd6a315bb060a9eb1e0f1cd12000f83e360cbfced3eafdc9ad44",
      "url": "https://github.com/spawn66336/threejsnative-sdk/releases/download/1.0.0/tjn-engine-android-1.0.0.aar"
    },
    {
      "architecture": "arm64-v8a+x86_64",
      "bytes": 1620109,
      "contentType": "application/zip",
      "kind": "maven-repository",
      "name": "tjn-engine-android-maven-1.0.0.zip",
      "platform": "android",
      "sha256": "7f8064fa1d6455cc1b7248f7961b4cff3c974fb4c2a234ca308aa7980c1840c7",
      "url": "https://github.com/spawn66336/threejsnative-sdk/releases/download/1.0.0/tjn-engine-android-maven-1.0.0.zip"
    },
    {
      "architecture": "arm64-v8a+x86_64",
      "bytes": 8436506,
      "contentType": "application/zip",
      "kind": "symbols",
      "name": "tjn-engine-android-1.0.0-symbols.zip",
      "platform": "android",
      "sha256": "038776ac85ca66c6e080cda17f4a87a4c31776d9084dc367290357f77ce297db",
      "url": "https://github.com/spawn66336/threejsnative-sdk/releases/download/1.0.0/tjn-engine-android-1.0.0-symbols.zip"
    },
    {
      "architecture": "arm64+simulator",
      "backend": "metal",
      "bytes": 5375549,
      "contentType": "application/zip",
      "kind": "package",
      "minimumSystem": "iOS 13.0",
      "name": "TjnEngineKit-1.0.0.xcframework.zip",
      "platform": "ios",
      "sha256": "c5ab750904d65f8b2d6340937eb8ce6646fb80952a767c219bf825f3d92b4103",
      "url": "https://github.com/spawn66336/threejsnative-sdk/releases/download/1.0.0/TjnEngineKit-1.0.0.xcframework.zip"
    },
    {
      "architecture": "arm64+x86_64",
      "backend": "metal",
      "bytes": 5375549,
      "contentType": "application/zip",
      "kind": "package",
      "minimumSystem": "macOS 11.0",
      "name": "TjnEngineKit-1.0.0.xcframework.zip",
      "platform": "macos",
      "sha256": "c5ab750904d65f8b2d6340937eb8ce6646fb80952a767c219bf825f3d92b4103",
      "url": "https://github.com/spawn66336/threejsnative-sdk/releases/download/1.0.0/TjnEngineKit-1.0.0.xcframework.zip"
    },
    {
      "architecture": "arm64+simulator+macos",
      "bytes": 65,
      "contentType": "application/octet-stream",
      "kind": "checksum",
      "name": "TjnEngineKit-1.0.0.checksum",
      "platform": "ios",
      "sha256": "1001560982aac5df748c25e96e1319f0583ecd2b7047de67edb569dac73e6427",
      "url": "https://github.com/spawn66336/threejsnative-sdk/releases/download/1.0.0/TjnEngineKit-1.0.0.checksum"
    },
    {
      "architecture": "arm64+simulator+macos",
      "bytes": 1930,
      "contentType": "application/zip",
      "kind": "symbols",
      "name": "TjnEngineKit-1.0.0-symbols.zip",
      "platform": "ios",
      "sha256": "cf0ca50a57a70668c927ba8439061c8bf4e17328779d42c4393589d648c7a27c",
      "url": "https://github.com/spawn66336/threejsnative-sdk/releases/download/1.0.0/TjnEngineKit-1.0.0-symbols.zip"
    },
    {
      "architecture": "x64",
      "backend": "d3d11",
      "bytes": 1018937,
      "contentType": "application/zip",
      "kind": "package",
      "minimumSystem": "Windows 10 2004",
      "name": "tjn-engine-windows-x64-1.0.0.zip",
      "platform": "windows",
      "sha256": "176a463e4db8a9def2b84a7b0c5b8fe967193dc0ec65f05afa81c5cefa669ec9",
      "url": "https://github.com/spawn66336/threejsnative-sdk/releases/download/1.0.0/tjn-engine-windows-x64-1.0.0.zip"
    },
    {
      "architecture": "arm64",
      "backend": "d3d11",
      "bytes": 924905,
      "contentType": "application/zip",
      "kind": "package",
      "minimumSystem": "Windows 10 2004",
      "name": "tjn-engine-windows-arm64-1.0.0.zip",
      "platform": "windows",
      "sha256": "27c603a6f706955e0f00433bfd28e0d1be3dfb769cec800523f0e3a8b7406773",
      "url": "https://github.com/spawn66336/threejsnative-sdk/releases/download/1.0.0/tjn-engine-windows-arm64-1.0.0.zip"
    },
    {
      "architecture": "x64+arm64",
      "bytes": 5518540,
      "contentType": "application/zip",
      "kind": "symbols",
      "name": "tjn-engine-windows-1.0.0-symbols.zip",
      "platform": "windows",
      "sha256": "a4a2f8ac4c0c1d9cd56f6a0dabd342dc29499dc989f1d2299f7385f473f8b482",
      "url": "https://github.com/spawn66336/threejsnative-sdk/releases/download/1.0.0/tjn-engine-windows-1.0.0-symbols.zip"
    },
    {
      "architecture": "all",
      "bytes": 8034,
      "contentType": "application/zip",
      "kind": "licenses",
      "name": "threejsnative-sdk-1.0.0-licenses.zip",
      "platform": "release",
      "sha256": "19170477ddefa3daa509a6b1786c8ab48956e60d7b61e59447ca2ec9bb4f8e7d",
      "url": "https://github.com/spawn66336/threejsnative-sdk/releases/download/1.0.0/threejsnative-sdk-1.0.0-licenses.zip"
    },
    {
      "architecture": "all",
      "bytes": 10717,
      "contentType": "application/json",
      "kind": "evidence",
      "name": "threejsnative-sdk-1.0.0.evidence.json",
      "platform": "release",
      "sha256": "faee45ddb7aa4ee0cca0c366c5740e8cca74cfd45be1c23a15733c475511c7e0",
      "url": "https://github.com/spawn66336/threejsnative-sdk/releases/download/1.0.0/threejsnative-sdk-1.0.0.evidence.json"
    },
    {
      "architecture": "all",
      "bytes": 2251,
      "contentType": "application/json",
      "kind": "reproducibility",
      "name": "threejsnative-sdk-1.0.0.reproducibility.json",
      "platform": "release",
      "sha256": "be0dbbf6efa639fbe1aa9034ab72159e815b48f88516d37bd7c86e92d75b7c3c",
      "url": "https://github.com/spawn66336/threejsnative-sdk/releases/download/1.0.0/threejsnative-sdk-1.0.0.reproducibility.json"
    },
    {
      "architecture": "all",
      "bytes": 6263,
      "contentType": "application/json",
      "kind": "sbom",
      "name": "threejsnative-sdk-1.0.0.sbom.spdx.json",
      "platform": "release",
      "sha256": "8ac3b7e0846b7c217dd98be57e7058b81dce82ca722a8e80f2cdbe7618becfcb",
      "url": "https://github.com/spawn66336/threejsnative-sdk/releases/download/1.0.0/threejsnative-sdk-1.0.0.sbom.spdx.json"
    },
    {
      "architecture": "all",
      "bytes": 2747,
      "contentType": "application/json",
      "kind": "provenance",
      "name": "threejsnative-sdk-1.0.0.provenance.json",
      "platform": "release",
      "sha256": "8da6ef1fae54aef7fc512147bda33f3e200522d57a7b99927f42cbf5a54aab0d",
      "url": "https://github.com/spawn66336/threejsnative-sdk/releases/download/1.0.0/threejsnative-sdk-1.0.0.provenance.json"
    }
  ],
  "assetSchemaDigest": "sha256:248afdf5acab47de2fd4f821a7fa34b778cc0e8bc612e09c5de8c6ded10d7811",
  "engineAbi": 1,
  "gates": {
    "androidRuntime": {
      "evidence": "threejsnative-sdk-1.0.0.evidence.json",
      "required": true,
      "status": "passed"
    },
    "appleRuntime": {
      "evidence": "threejsnative-sdk-1.0.0.evidence.json",
      "required": true,
      "status": "passed"
    },
    "metahumanContract": {
      "evidence": "threejsnative-sdk-1.0.0.evidence.json",
      "required": true,
      "status": "passed"
    },
    "packageSecurity": {
      "evidence": "threejsnative-sdk-1.0.0.evidence.json",
      "required": true,
      "status": "passed"
    },
    "reproducibleBuilds": {
      "evidence": "threejsnative-sdk-1.0.0.evidence.json",
      "required": true,
      "status": "passed"
    },
    "sourceClean": {
      "evidence": "threejsnative-sdk-1.0.0.evidence.json",
      "required": true,
      "status": "passed"
    },
    "webRuntime": {
      "evidence": "threejsnative-sdk-1.0.0.evidence.json",
      "required": true,
      "status": "passed"
    },
    "windowsRuntime": {
      "evidence": "threejsnative-sdk-1.0.0.evidence.json",
      "required": true,
      "status": "passed"
    }
  },
  "parityDigest": "sha256:92b26358d8fd759c01076dd223af5cbad78ceefa981182034cf7d83b44041e99",
  "publicSymbolDigest": "sha256:d653976a29012e7458febadc95a5daae3e99594af09dead353c80e19ed2121bc",
  "publishedAt": "2026-07-27T08:14:49Z",
  "releaseUrl": "https://github.com/spawn66336/threejsnative-sdk/releases/tag/1.0.0",
  "schema": "tjn.sdk-release.v1",
  "signing": {
    "attestation": "github-attestation",
    "checksums": "sha256",
    "provenance": "threejsnative-sdk-provenance.v1"
  },
  "source": {
    "commit": "7fc850f9c8e3f9051e96666e6113a16cc14a117e",
    "repository": "https://github.com/spawn66336/ThreejsNative"
  },
  "toolchains": [
    {
      "architecture": "arm64-v8a+x86_64",
      "compiler": "openjdk version \"17.0.19\" 2026-04-21 | OpenJDK Runtime Environment Temurin-17.0.19+10 (build 17.0.19+10) | OpenJDK 64-Bit Server VM Temurin-17.0.19+10 (build 17.0.19+10, mixed mode, sharing)",
      "platform": "android",
      "runner": "ubuntu24 20260720.247.2 x86_64"
    },
    {
      "architecture": "ios+macos-universal",